cui,ano,prestaciones,descripcion_obra
0601578,2021,Gas,Cambio de reguladores de gas
0601578,2022,Gas,PROVISION Y COLOCACION MECHEROS
0601587,2022,Albañileria / Pintura,"Reparación terraza, puertas b°y otros"
0601587,2022,Electricidad,SDF 3 AULAS 2023
0601587,2023,Electricidad,INSTALACION EN ESPACIOS SEGUROS
0601599,2021,Electricidad,"Adecuacion de pilar e inst. eléctrica, Colocación e instalación luces emergenci"
0601599,2022,Albañileria / Pintura,"pintura de paredes y carpinterías, Prov. Coloc.de piso antígolpe, Arreglos y pintura de patio, Pintura de cabriadas de cubierta"
0601599,2022,Cubiertas / Impermeabilizaciones,Rep. y cambio chapas de techo
0601650,2021,Gas,Reparaciones en instalacion de gas
0601650,2022,Electricidad,Instalación de purificadores
0601650,2022,Gas,Reemplazo de anafe en sala auxiliares
0601656,2021,Albañileria / Pintura,reemplazo de cielorraso en varios sector
0601656,2021,Electricidad,Tendido alimentacion electrica de jardin
0601656,2021,Gas,Reemplazo termotanque sala auxiliares
0601656,2021,Medios de elevación,puesta en norma del ascensor
0601656,2022,Incendio,"Provision de matafuego en cocina, Instalación de detectores"
0601656,2022,Sanitarias,Acondicionamiento de acceso a tanque
0601659,2022,Carpinterías,Adecuación de aula de recuperacion
0601662,2021,Electricidad,Adecuación de iluminación de emergenci
0601662,2021,Gas,levantamiento de corte de suministro
0601665,2021,Albañileria / Pintura,Pintura de Paredes 4 aulas y administrat
0601665,2022,Gas,Adecuación instalación de gas
0601668,2023,Medios de elevación,Cambio variador de velocidad ascensor
0601680,2021,Sanitarias,Adecuación de baños docentes
0601680,2023,Gas,Inst. de Gas
0601683,2021,Calefaccion y Refrigeracion,"Inst de dos equipos de Aire Acdo, Reposición 2 (dos) radiadores"
0601683,2021,Gas,Instalación de horno nuevo
0601683,2022,Calefaccion y Refrigeracion,"Adecuación de sistema de calefaccion, Adicional obra de reac. calefaccion"
0601683,2022,Carpinterías,Colocar 2 puertas-Baño jardín
0601683,2022,Cubiertas / Impermeabilizaciones,Impermeab. terraza sector biblioteca
0601683,2022,Electricidad,Instalación de purificadores
0601692,2021,Carpinterías,Cerco sector juegos jardín de infantes
0601692,2021,Medios de elevación,Reparación de la plataforma elevadora
0601695,2021,Electricidad,Reparación de red telefónica interna
0601695,2021,Medios de elevación,puesta en norma del ascensor
0601695,2022,Carpinterías,Colocacion de rejas en ventanas de aulas
0601695,2022,Medios de elevación,Puesta en servicio del ascensor
0601695,2023,Albañileria / Pintura,"Tabiques de durlock en aulas de inicial, Refuncionalizacion de deposito para aula"
0601695,2023,Electricidad,Reacondicionamoento de instalación eléct
0601698,2021,Gas,Reparar instalcion de gas
0601698,2021,Sanitarias,Cambio de tanques cisterna y de reserva
0601698,2022,Cubiertas / Impermeabilizaciones,Impermeabilizacion casa casera
0601698,2022,Electricidad,Instalación de purificadores
0601719,2021,Carpinterías,Cambio de cerco .perimetral
0601719,2022,Carpinterías,Reparación de reja perimetral
0601722,2021,Albañileria / Pintura,"Secundaria del Futuro 2021, Reparación solado exterior"
0601722,2021,Electricidad,Secundaria del futuro 2022
0601722,2022,Calefaccion y Refrigeracion,Provisión de caldera de calefacción
0601722,2022,Incendio,Trabajos en la IFCI
0601722,2023,Electricidad,INSTALACION EN ESPACIOS SEGUROS
0601737,2023,Albañileria / Pintura,Cielorraso de surlock en B° PA
0601752,2021,Calefaccion y Refrigeracion,Puesta a punto estufas e inst de gas
0601755,2022,Calefaccion y Refrigeracion,REPARACION DE FANCOIL Y CAMBIO DE MOTOR
0601755,2022,Electricidad,"Colocación de luces de emergencia, Instalación de purificadores"
0601764,2022,Electricidad,Colocación luces emergencia
0601764,2022,Gas,"REACONDICIONAMIENTO INST GAS, COCINA Y VENTILACIONES"
0601764,2022,Incendio,Proveer e instalar extintores
0601764,2023,Calefaccion y Refrigeracion,INSTALACION ELECTRICA PARA SPLITS  AA
0601767,2021,Albañileria / Pintura,"Acond Sala Informática c/Radio y Multim, Rep adicional revoques de S Informática"
0601767,2021,Electricidad,Instalación 7 equipos purificadores aire
0601767,2021,Gas,"Cambio TB aula 2, 3 y Sala Maestros, Ejecutar Recomendac. Form. Metrogas"
0601767,2023,Gas,Ventilación cocina s/pedido
0601770,2021,Carpinterías,Adecuación puerta de acceso.
0601770,2021,Electricidad,Colocación de purificadores.
0601770,2021,Incendio,Provisión de matafuegos
0601779,2022,Carpinterías,"Protecciones en Terraza y Jardín, Prov. y coloc. de protec. antipalomas"
0601779,2023,Incendio,"Luces de emergencia, Reparación de central de alarma IFCI"
0601782,2021,Gas,Puesta en norma de inst de gas
0601782,2021,Sanitarias,Sala de bombeo-Aula-Sala jardin-Pasillo.
0601782,2022,Electricidad,"Cambiar portero eléctrico de casero, Ventilador de SUM y reemp artef de luz"
0601782,2023,Electricidad,Completar iluminación de emergencia. Seg
0601782,2023,Sanitarias,Cambio de depósito inodoro baño casero
0601785,2023,Sanitarias,INSTALACIÓN BOMBA DE AGUA
0601788,2021,Carpinterías,PINTURA EXTERIOR PATIO
0601788,2022,Gas,REACONDICIONAMIENTO INST GAS
0601803,2021,Electricidad,Colocación de luces de emergencia
0601803,2021,Sanitarias,Reparaciones de albañilería y sanitarias
0601803,2022,Gas,Adecuación instalación de gas
0601806,2021,Sanitarias,Cambio de cañerìa cloacal y pluvial
0601857,2021,Electricidad,instalar purificador en sala jardin
0601857,2021,Gas,Poner en norma instalacion de gas renglo
0601857,2021,Incendio,Reponer matafuegos
0601857,2022,Electricidad,Reemplazar ventiladores rotos
0601857,2022,Gas,instalar cocina en sector concesionario.
0601857,2022,Sanitarias,Cambiar cuadro de ducha-Casa casera
0601857,2023,Albañileria / Pintura,"Rep. piso cocina consecionario, Reparar sala de maestros"
0601872,2021,Albañileria / Pintura,Recomponer 3 canteros
0601872,2021,Gas,Poner en norma instalacion de gas renglo
0601872,2021,Sanitarias,Cambiar tanque de reserva
0601872,2022,Calefaccion y Refrigeracion,Reemplazar 5 estufas tiro balanceado
0601872,2023,Albañileria / Pintura,Reparar mampostería de arco-Pasillo PA
0601872,2023,Electricidad,Reemplazar ventiladores rotos.
0601881,2021,Calefaccion y Refrigeracion,Colocar 7 purificadores de aire
0601881,2021,Carpinterías,Proveer y colocar puerta en B° nenes
0601881,2021,Electricidad,colocar 3 purificadores de aire
0601881,2022,Albañileria / Pintura,Pintura en frisos
0601881,2022,Electricidad,Prov y coloc 2 veentiladores
0601881,2022,Gas,"Adecuación de la Instalación de Gas, ADECUACION DE GAS 2 PARTE"
0601887,2021,Electricidad,Reemplazo de portero eléctrico
0601887,2021,Gas,"Adecuacion instalacion de gas-Cocina, Coloc horno a vapor, Colocar una campana con conducto, Tramo de red expuesto"
0601887,2021,Sanitarias,"Reemplazo de bomba de impulsión,"
0601887,2022,Gas,Adecuación de la instalación de gas.
0601914,2023,Electricidad,Prov.Coloc.  dos ventiladores
0601917,2021,Electricidad,"Coloc 2 tomas para purificadores, cambia"
0601917,2021,Gas,Adecuar a normativa Inst de Gas
0601917,2022,Electricidad,"Provision y colocacion de luces de emer, Reemplazo de central telefonica"
0601917,2022,Incendio,Colocación lanzas faltantes polipropilen
0601926,2022,Gas,Adecuación instalación de gas
0601926,2022,Incendio,Provisión de matafuegos
0601926,2023,Carpinterías,Colocación de vidrios de seguridad
0601944,2021,Gas,"Prov, coloc calefon"
0601944,2021,Sanitarias,"Reemplazo griferia, la griferia a coloca"
0601944,2022,Albañileria / Pintura,"Reemp piso vinilico-Pintura de patio, EJECUCION DE PLATEA"
0601971,2022,Carpinterías,Prov. Coloc. protección metalica
0601977,2021,Electricidad,"Adecuacion tableros electricos, Colocacion de purificadores"
0601977,2022,Albañileria / Pintura,"Luces de emergencia ,pintura aula pb y f"
0601986,2021,Carpinterías,Reja protectora en terraza
0601986,2022,Albañileria / Pintura,Refuerzo bovedilla-Techo de cocina
0601986,2022,Electricidad,Instalacion de purificadores
0601992,2022,Electricidad,Adecuación eléctrica y cambio zocaloduct
0601992,2022,Sanitarias,"Cambio de 3 tapas de camaras en patio, Cambio de tanque bombeo subsuelo"
0601998,2021,Incendio,Inst. contra incencio y red antipalomas
0601998,2021,Otros Servicios,Pintura y colocacion de guardaganado
0601998,2021,Sanitarias,Cañería AF B° Docentes-Pintura Comput.
0601998,2022,Electricidad,Instalacion de purificador en comedor
0601998,2022,Medios de elevación,Habilitacion plataforma elevadora
0601998,2022,Sanitarias,"Cambio tanque cisterna y pinches palomas, Cambio tanque reserva, pinches o red ant"
0601998,2023,Sanitarias,Prov. Coloc termotanque electrico
0602001,2021,Albañileria / Pintura,"Pintura general en acceso, pasillo, pati"
0602001,2021,Electricidad,Colocacion de purificadores
0602001,2021,Gas,"Adecuacion instalacion de gas, cambio ar"
0602001,2022,Gas,Adecuacion inst gas y pintura aulas
0602013,2021,Albañileria / Pintura,Pintura sala de maestros y reparacion ba
0602013,2021,Electricidad,Colocacion de purificadores
0602013,2022,Albañileria / Pintura,"Pintura aulas PA,hall acceso,fachada,pat"
0602016,2021,Carpinterías,"Reja ventana sala jardin, Cambiar persianas"
0602016,2021,Electricidad,Instalación ventiladores en comedor
0602016,2022,Carpinterías,Reacondicionamiento Biblioteca
0602016,2023,Gas,TRABAJO DE GAS EN COCINA
0602019,2022,Electricidad,Instalacion de purificadores
0602019,2022,Sanitarias,Cambio de tanques de agua
0602022,2021,Gas,Adecuacion instalacion de gas
0602022,2021,Incendio,Instalación Fija Contra Incendi
0602022,2022,Albañileria / Pintura,Ejecución de vallado perimetral  quincho
0602022,2022,Sanitarias,Cambio tanque de agua casera
0602025,2021,Gas,"Caldera, reguladores y ceramicos"
0602025,2021,Sanitarias,Cambio de bombas de elevacion
0602025,2022,Albañileria / Pintura,Colocacion placas de aislacion
0602025,2022,Electricidad,Reemplazo de caja/tabero
0602043,2021,Electricidad,Luces de emergencia
0602043,2021,Gas,Adecuacion instalacion de gas
0602043,2022,Calefaccion y Refrigeracion,Instalación aire acondicionado
0602043,2022,Electricidad,"Readecuacion tableros, alimentacion toma"
0602055,2021,Gas,Adecuacion instalacion de gas
0602055,2022,Albañileria / Pintura,"Pintura 2 aulas y provision termo., Ejecucion alero y reparacion junta patio"
0602055,2023,Carpinterías,Cambio canaleta y pluviales gimnasio
0602061,2021,Gas,Adecuacion inst. de gas casa casero
0602061,2022,Carpinterías,Reposición cortina blackout
0602061,2022,Electricidad,Iluminación exterior
0602061,2023,Electricidad,Secundarias del Futuro 2 aulas 1 año
0602124,2021,Cubiertas / Impermeabilizaciones,"Cambio de cubierta, cuarto de auxiliares"
0602124,2021,Electricidad,Instalacion de purificadores
0602124,2022,Carpinterías,Colocacion de mosquiteros
0602130,2021,Calefaccion y Refrigeracion,Reemplazo estufas y adaptación tirajes
0602130,2021,Carpinterías,Colocar malla antipalomas en ventanas
0602130,2021,Electricidad,Instalación para 8 purificadores de aire
0602139,2021,Electricidad,"Iluminación LED en espacios de PB, Instalacion de 8 purificadores Se devuel"
0602139,2022,Calefaccion y Refrigeracion,Trabajos en caldera. Se vuelven a solici
0602142,2021,Cubiertas / Impermeabilizaciones,Reparar instalaciones cloacales en baños
0602142,2021,Sanitarias,Trabajos en cañeria cloacal
0602142,2022,Albañileria / Pintura,Cielorraso suspendido-Comedor
0602142,2022,Calefaccion y Refrigeracion,Instalación de cañerías nuevas de calefa
0602142,2022,Carpinterías,Reemplazo del ventanal de hierro
0602142,2022,Medios de elevación,Cambio de la placa de seguridades
0602142,2022,Sanitarias,Reparar y limpiar cámara desengrasadora
0602142,2023,Albañileria / Pintura,Pintura de casrpinterías en comedor
0602142,2023,Carpinterías,Instalacion de Alambrado Olimpico
0602142,2023,Otros Servicios,Cambio de cañería cloacal y acondicionam
0602145,2021,Carpinterías,Adecuación de planta alta
0602145,2021,Electricidad,"Colocación luces emergencia, Instalacion de purificadores de aire"
0602145,2022,Carpinterías,Colocar lona-Cubierta en patio
0602145,2022,Cubiertas / Impermeabilizaciones,Toldo de chapa en ingreso a E.E.
0602145,2022,Sanitarias,Reemplazo red cloacal Bº nenas
0602148,2021,Carpinterías,Colocación pinches antipaloma en fachada
0602148,2022,Albañileria / Pintura,Reparacion y pintura completa de paredes
0602148,2022,Cubiertas / Impermeabilizaciones,Colocar membrana-Cubierta aulas Jardín
0602151,2022,Sanitarias,Impermeabilización de bajadas y rejillas
0602181,2022,Albañileria / Pintura,"Secundarias del Futuro, Pulido y pastificado parquet SUM P.A., SDF 2 AULAS 2023"
0602181,2022,Calefaccion y Refrigeracion,Cambiar quemador y modificar chimenea
0602181,2022,Carpinterías,Provisión de puerta trampa de chapa
0602181,2022,Electricidad,Reparación central alarma incendio
0602181,2023,Electricidad,INSTALACION EN ESPACIOS SEGUROS
0602232,2021,Cubiertas / Impermeabilizaciones,Impermeabilización terraza vivienda
0602232,2022,Sanitarias,Instalación de termotanque en cocina
0602232,2023,Albañileria / Pintura,Reparación de revoques y pintura
0602235,2021,Carpinterías,"Aberturas, cerramientos"
0602235,2021,Sanitarias,Cambio caño alimentacion tanque casera
0602235,2022,Carpinterías,Nueva alimentación a tanque cisterna
0602241,2021,Electricidad,"Instalacion de purificadores de aire, Cambio de central telefónica"
0602241,2022,Electricidad,"Prov. y coloc. de luces de emergencia, Timbre de recreo automatico"
0602241,2023,Sanitarias,Cambio de un tanque cisterna
0602244,2021,Cubiertas / Impermeabilizaciones,Ampliación de instalación eléctrica
0602244,2021,Sanitarias,Inst. camara interceptora de grasa. Se s
0602244,2022,Albañileria / Pintura,Construcción de una pared gimnasio
0602244,2022,Carpinterías,construcción alero de chapa Se solicita
0602244,2022,Sanitarias,Reemplazo del tanque de reserva
0602247,2021,Albañileria / Pintura,Arreglar filtracion terraza
0602247,2021,Calefaccion y Refrigeracion,Instalacion equipos de aire acondicionad
0602247,2023,Electricidad,Reacondicionar  tablero electrico
0602250,2021,Calefaccion y Refrigeracion,Instalacion de estufas TBU
0602250,2021,Carpinterías,Colocacion de Red Antipalomas
0602250,2021,Gas,Instalaciones de gas
0602250,2021,Incendio,Reponer 10 extintores
0602253,2021,Gas,Proveer y colocar cocina-Casa casero
0602253,2022,Albañileria / Pintura,"Prov colocacion  cielorraso, Pintura gral en paredes Y carpinterias, Pintura gral de cielorraso, paredes"
0602253,2022,Cubiertas / Impermeabilizaciones,Cambio de canaleta de zinc
0602256,2021,Albañileria / Pintura,Albañilería- Instalaciones
0602256,2021,Electricidad,Instalacion Electricidad- Purificadores
0602256,2021,Sanitarias,Reparación cámara cloacal
0602256,2022,Calefaccion y Refrigeracion,Reparar calefacción
0602256,2023,Electricidad,Prov y col de 12 ventiladores
0602259,2022,Electricidad,Colocación luces emergencia
0602274,2022,Otros Servicios,Limpieza total de la casa habitación
0602274,2023,Albañileria / Pintura,Pintura general en patios de primaria
0602277,2021,Albañileria / Pintura,"reparación pared sala jardín, Colocación mesada en cocina, alba. pared"
0602277,2021,Gas,readecuación instalación de gas
0602277,2022,Electricidad,PROV Y COLOCACION DE LUCES DE EMERGENCIA
0602280,2021,Saneamiento,Proveer y colocar 7 purificadores
0602280,2022,Cubiertas / Impermeabilizaciones,Ejecución de nueva canaleta de zinc
0602298,2021,Carpinterías,colocar reja de malla soldada 5 x 5 PA
0602298,2021,Electricidad,reemplazo central telefónica
0602298,2023,Albañileria / Pintura,"SDF 2 AULAS 2023, Espacio Digital"
0602298,2023,Calefaccion y Refrigeracion,"prov y col de 2 radiadores en aulas, prov y col de 2 bombas recircu calef"
0602307,2021,Albañileria / Pintura,"Reparar Cielorrasos 1ero,2do y 3er grado"
0602307,2021,Electricidad,"Instalación 7 equipos purificadores aire, Puesta en norma Tablero Principal en SS"
0602307,2022,Albañileria / Pintura,"2da etapa Reparac Cielorr Aulas 1,2,3"
0602307,2022,Calefaccion y Refrigeracion,"Puesta en marcha de calefacción, Cambio equipo calefactor fin vida útil"
0602307,2023,Electricidad,Inst. Eléctrica s/etapas prevista
0602310,2021,Electricidad,Instalación 4 equipos purificadores aire
0602310,2021,Incendio,Reparar tablero control
0602310,2021,Sanitarias,Rep tramo cloacal Bº M-patio trasero
0602310,2022,Calefaccion y Refrigeracion,Proveer Split frío/calor de 3000
0602310,2022,Cubiertas / Impermeabilizaciones,Insonorización 2da parte
0602310,2022,Electricidad,Insonorización extracción cocina
0602310,2022,Sanitarias,Reponer mingitorio roto por vandalismo
0602310,2023,Gas,Estufa en sala plastica
0602316,2021,Electricidad,"Instalación 3 equipos purificadores aire, Provisión y coloc TT eléctr.Vivi Casera"
0602316,2021,Gas,Ejecutar Recomendac. Form. Metrogas
0602316,2021,Incendio,Reemplazo 1 matafuegos ABC
0602316,2022,Gas,doble regulación en nicho solic Metrogas
0602316,2023,Albañileria / Pintura,Reparación Cielorrasos Circulación y Bañ
0602319,2021,Electricidad,Instalar 6 equipos purificadores
0602319,2022,Electricidad,Instalacion luces de emergencia
0602325,2023,Otros Servicios,Vallado de contención
0602346,2021,Gas,Pintura Circulación y Prov 6 TB
0602346,2021,Sanitarias,"Cambio hojas puertas placa Bo Alumnos, Desag.Cloacal 1erP+CielorrasoPb Baños Al"
0602346,2022,Albañileria / Pintura,Cielorraso Circulación der 1er piso
0602346,2022,Sanitarias,Reparación cloaca y nueva CI
0602346,2023,Sanitarias,Provisión de bomba faltante
0602349,2021,Calefaccion y Refrigeracion,Colocación de purificadores
0602349,2021,Gas,"Adecuaciones de instalaciones e cocina, Recambio de Termotanque"
0602349,2022,Calefaccion y Refrigeracion,Instalación AA
0602349,2022,Medios de elevación,reacondicionamiento de ascensor
0602349,2022,Sanitarias,Refuncionalización de sanitario C-H
0602349,2023,Albañileria / Pintura,Cielorraso desmontable en comedor
0602358,2021,Electricidad,Instalación 6 equipos purificadores aire
0602358,2021,Gas,Reempl 2 tb y 4 griferías economiz. agua
0602358,2021,Medios de elevación,Funcionamiento ascensor
0602358,2022,Albañileria / Pintura,Pintura de  4 Aulas
0602358,2023,Electricidad,"Reparar sist alarma incendio s/infoAsba, Reparar tablero A A"
0602361,2021,Electricidad,Instalacion 5 equipos purificadores
0602361,2022,Electricidad,Instalacion luces de emergencia
0602364,2022,Cubiertas / Impermeabilizaciones,Colocar red antipaloma en patio
0602364,2023,Albañileria / Pintura,Reparacion  revoques y pintura
0602367,2021,Gas,"Provision y colocación de termotanque, Adecuar a normativa Inst de Gas"
0602367,2022,Sanitarias,Reponer inodoro baño de nenas
0602367,2023,Albañileria / Pintura,"Pintura de Paredes techos, y carpintería"
0602385,2021,Albañileria / Pintura,Baranda protectora y pintura
0602385,2022,Electricidad,Reemplazo de paneles led quemados
0602385,2022,Gas,Doble regulación de gas
0602385,2023,Albañileria / Pintura,Pintura patio interior
0602385,2023,Electricidad,PROV Y COLOC LUCES EMERGENCIA
0602403,2022,Gas,Recambio de artefacto cocina
0602403,2023,Albañileria / Pintura,Reparar revoque y pintura office y baños
0602403,2023,Carpinterías,Coloc red antipaloma en ventanas
0602415,2021,Electricidad,Colocación de purificadores
0602415,2021,Incendio,Colocación de luces de emergencia
0602415,2022,Albañileria / Pintura,Arreglos de revoques y pintura
0602415,2022,Electricidad,Reemplazo de 3 ventiladores
0602415,2022,Sanitarias,Solicitud tapa de inodoros
0602415,2023,Carpinterías,Mallado en reja de acceso
0602424,2021,Albañileria / Pintura,Rep Revoques-Pintura Aulas Etapa 1
0602424,2021,Electricidad,Instalacion Purificadores de Aire
0602424,2022,Albañileria / Pintura,Demoler pileta en Sala 4y5 Inicial
0602424,2022,Electricidad,Instalacion luces de emergencia
0602424,2023,Albañileria / Pintura,Reparacion friso y pintura Aula musica
0602424,2023,Carpinterías,Cambiador en baño Sala 2
0602424,2023,Gas,Adecuación Inst. Gas
0602436,2021,Albañileria / Pintura,Reparacion frisos SUM-Circulacion
0602436,2022,Albañileria / Pintura,Recolocacion Revestimiento Aula
0602436,2022,Carpinterías,Recambio de todos los policarbonato
0602436,2022,Electricidad,Colocacion de 4 ventiladores de pared
0602445,2021,Gas,"Cambio de estufa en 4to grado, Reemplazo de termotanque en cocina"
0602445,2022,Albañileria / Pintura,"Tratamiento ignifugo en escenario, Arreglos de revoque y pintura"
0602445,2022,Cubiertas / Impermeabilizaciones,Reparación de cubierta en sala
0602445,2022,Electricidad,Reemplazo de 2 ventiladores
0602445,2022,Gas,Protecciones para estufas
0602445,2022,Incendio,Colocación de luces de emergencia
0602445,2023,Albañileria / Pintura,"Red de contencion para palomas, Red anti palomas en ventana"
0602454,2021,Albañileria / Pintura,Reparar revoques y pintura aulas fachada
0602454,2021,Carpinterías,"Protecciones para carpinterias, Coloc malla,barral ventanas puerta acces"
0602454,2021,Incendio,Provision de extintor para cocina
0602454,2022,Albañileria / Pintura,"Colocacion timbre para jardin, Colocar soporte para proyector en aula"
0602454,2022,Electricidad,"Reemplazo de 3 ventiladores, Tendido eléctrico para AA-Aulas Jardín"
0602454,2023,Electricidad,Colocación de equipo forzado para ventil
0602457,2021,Sanitarias,cambiar de artefactos sanitarios
0602457,2022,Albañileria / Pintura,"Colocar piso antigolpes-Revoques y pint., Arreglos revoques  patio sobre escenario"
0602457,2022,Electricidad,Reemplazo de 2 ventiladores
0602457,2023,Electricidad,5 ventiladores
0602469,2021,Carpinterías,"Prov, coloc escalera p/acceso azotea"
0602469,2021,Electricidad,Instalar 5 purificadores
0602469,2023,Albañileria / Pintura,Reemplazo de vidrios de ventanas
0602496,2021,Albañileria / Pintura,TERMINACIONES SALONES DE DANZAS Y HERRER
0602496,2021,Carpinterías,"Baranda protectora, Cerramiento de seguridad en anexo Muratu"
0602496,2021,Electricidad,Instalacion de 16 equipos purificadores
0602496,2021,Gas,"Adecuaciones gas, extracción y ventilaci"
0602496,2021,Sanitarias,Destapacion de piletas de decantacion
0602496,2022,Electricidad,Adecuacion biblioteca
0602496,2022,Sanitarias,"Destapación de piletas decantacion, Destapación de piletas de decantación"
0602508,2021,Gas,Revision y reintegro del servicio de gas
0602508,2022,Electricidad,Prov. Coloc 3 ventiladores
0602535,2021,Albañileria / Pintura,Reparación cubierta y cielorraso
0602535,2021,Calefaccion y Refrigeracion,Instalar 6 purificadores
0602535,2021,Carpinterías,Colocación rejas existentes en Gimnasio
0602535,2021,Electricidad,Colocación de Timbre Programable
0602535,2021,Gas,Adecuación instalación de gas
0602535,2021,Incendio,Incendio: Reemplazo de extintore
0602535,2021,Medios de elevación,Reposición piezas montasilla
0602535,2021,Sanitarias,Provisión de nueva bomba impulsora
0602535,2022,Electricidad,Colocación Tomas Salas y Sanitizador
0602538,2021,Electricidad,Instalación de 2 purificadores
0602538,2021,Gas,Adecuación x Inspección Metrogas
0602538,2021,Sanitarias,Cambio de tapa de tanque de reserva
0602538,2022,Albañileria / Pintura,Rep. grietas en cielorraso de material
0602538,2022,Calefaccion y Refrigeracion,Instalar Split Sala Computación
0602538,2022,Cubiertas / Impermeabilizaciones,Filtraciones cubierta comedor
0602538,2023,Calefaccion y Refrigeracion,Reemplazo y Acondicionamiento Estufas
0602538,2023,Carpinterías,Placas ignifugas
0602544,2022,Calefaccion y Refrigeracion,"Instalacion de purificadores de aire, Reemplazar estufas de tiro balanceado."
0602544,2022,Sanitarias,Camara septica y desagües cloacales
0602550,2022,Calefaccion y Refrigeracion,Instalacion de purificadores de aire
0602550,2022,Electricidad,Iluminación en terraza
0602550,2022,Gas,Artefacto de cocina para casa casero.
0602553,2021,Medios de elevación,Habilitacion del ascensor
0602553,2022,Gas,Cambio de reguladores.
0602553,2022,Medios de elevación,decuación del ascensor
0602568,2021,Carpinterías,Provisión y colocacioón vidrios
0602568,2021,Gas,"reparación e instalacion de gas, adecuación de caldera"
0602568,2021,Incendio,"Recambio central de incendio, Reemplazo de matafuegos"
0602568,2022,Calefaccion y Refrigeracion,Placas calefactores electricos
0602568,2022,Electricidad,Adecuación de sistema de caldera
0602568,2022,Gas,Adecuación de sistema de gas.
0602571,2021,Cubiertas / Impermeabilizaciones,"Demolicion terraza patio casera, imperme"
0602571,2021,Gas,Adecuacion de instalacion de gas
0602574,2021,Electricidad,Instalación de toma termotanque
0602574,2022,Carpinterías,Prov y coloc. vidrio roto x vandalismo
0602574,2022,Electricidad,inst. prov. ventiladores
0602574,2022,Gas,Adecuacion instalacion de gas
0602577,2021,Cubiertas / Impermeabilizaciones,Impermeabilizacion patio casero
0602577,2021,Electricidad,Reposicion caja termicas y cableado
0602577,2021,Incendio,Cambio bomba incendio por vandalismo
0602577,2022,Gas,"Puesta en normativa gas por Metrogas,sal"
0602577,2022,Otros Servicios,Colocar tomas en aulas
0602637,2021,Albañileria / Pintura,"Cerco medianero con fundacion y rejas, Refacciones Aulas del Futuro + cerramien"
0602637,2021,Gas,Reposicion termotanque en secretaria jar
0602637,2022,Carpinterías,Secundarias del Futuro
0602658,2021,Incendio,"Cambio de extintores, mangueras y lanzas"
0602658,2022,Sanitarias,Recambio de tapa de tanque de reserva
0602658,2023,Electricidad,Edificación de aula
0602712,2022,Albañileria / Pintura,Colocar redes plásticas y bandejas
0602712,2022,Calefaccion y Refrigeracion,Proveer y coloc 5 estufas de 5000 calorí
0602718,2021,Albañileria / Pintura,Pintura varios sectores
0602733,2022,Calefaccion y Refrigeracion,Instalación para A°A°
0602736,2022,Cubiertas / Impermeabilizaciones,Reparar filtraciones en techo
0602739,2021,Carpinterías,Retirar juegos de patio de jardin
0602745,2021,Albañileria / Pintura,Rep filtraciones y pintura en S. Música
