cui,ano,prestaciones,descripcion_obra
0801600,2022,Calefaccion y Refrigeracion,"Estufa de 5700kcal., INSTALACION DE 4 AA EN SALAS JARDIN"
0801600,2022,Carpinterías,Coloc. carpinterias salas de jardin
0801600,2022,Electricidad,RECOLOCAR REFLECTORES EN FACHADA
0801600,2022,Incendio,SSTEMA DE PROTECCIÓN CONTRA INCENDIO
0801600,2023,Electricidad,Reparacion de Sistema de Vigilancia
0801612,2021,Calefaccion y Refrigeracion,"Cambio de 4 convectores, Reacondicionamiento de caldera"
0801612,2021,Carpinterías,"Barandas perimetr,barrales,red antipalom"
0801612,2022,Albañileria / Pintura,Prov. coloc. cambiador para niños
0801612,2022,Calefaccion y Refrigeracion,"Reacondicionar 2 radiadores, Intervención tendido de calefacción"
0801612,2022,Electricidad,"Colocación de luces de emergencia, Reacondicionamiento de telefonia"
0801612,2022,Saneamiento,"Toma de muestra, material sospechoso"
0801612,2023,Electricidad,Prov. Coloc.  7 ventiladores
0801612,2023,Saneamiento,"Proveer certificados, obleas"
0801616,2021,Incendio,Provision de matafuegos faltantes
0801616,2021,Otros Servicios,"Reparaciones generales de Gas, Adecuacion instalacion Gas Sector cocina"
0801616,2022,Carpinterías,Proveer e instalar proteccion red
0801616,2022,Electricidad,Provision e iinstalacion luces en patio
0801616,2022,Otros Servicios,"Adecuacion inst. electrica direccion jar, PROVISION E INST. DE VENTILADORES"
0801616,2023,Otros Servicios,PROVISION E INST. DE VENTILADORES
0801620,2021,Calefaccion y Refrigeracion,Reparacion de Radiadores en PA
0801620,2022,Albañileria / Pintura,Retiro de solado de mosaico
0801620,2023,Electricidad,Inst. alarma y camara espacio Seguro
0801624,2022,Calefaccion y Refrigeracion,Reacondicionar sector electrico caldera
0801624,2023,Carpinterías,"Ejecución de oficina y cambiador en sala, Prov. Coloc. Mosquiter en ventana"
0801624,2023,Electricidad,Instalación de tomas en oficina
0801636,2021,Albañileria / Pintura,Pintura cielorraso-Proteccion barandas
0801636,2021,Medios de elevación,habilitacion montasilla
0801636,2022,Carpinterías,provision y colocacion de cerramiento
0801636,2022,Medios de elevación,Reparación montasilla
0801636,2023,Albañileria / Pintura,Pintura de Paredes y carpinterias 4 sala
0801640,2021,Electricidad,Instalación equipo de A° ° Biblioteca
0801644,2021,Cubiertas / Impermeabilizaciones,Tabique para elevar dos bombas
0801644,2023,Calefaccion y Refrigeracion,Adecuacion sistema de calefacción
0801644,2023,Electricidad,Instalación de purificadores en el EE
0801644,2023,Gas,Reparar medidores de gas
0801664,2022,Incendio,ADECUACIÓN SISTEMA FIJO CONTRA INCENDIO
0801664,2022,Saneamiento,DESRATIZACION 50 CAJAS
0801704,2021,Albañileria / Pintura,Adecuar desniveles en ingresos
0801704,2021,Carpinterías,Adecuar nucleo sanitario Bº PB
0801704,2021,Electricidad,Coloc purificador en aula PB
0801704,2021,Gas,Readecuacion instalacion de gas}
0801704,2022,Incendio,Recarga de matafuegos descargado
0801704,2022,Sanitarias,Cambiar termotanque de laboratorio
0801704,2023,Gas,"Reacondicionamiento del gas en el buffet, Reacondicionamiento de gas en buffet"
0801708,2021,Carpinterías,Colocar rejas-Sala digital y balcones 1P
0801708,2021,Sanitarias,Recambio de cañeria de tanques
0801708,2022,Albañileria / Pintura,"Pintura SUM integral, Desmonte de pilar perimetro patio jardin, Pintura de carpinterias de SUM, Cambio solados y pintura en salas"
0801708,2022,Carpinterías,"Prov. y coloc. de rejas, Prov. Coloc. 7 rejas en puertas"
0801708,2022,Electricidad,Reacondicionamiento de telefonia
0801708,2022,Gas,"Reacondicionamiento de gas, Acondicionar instalación de gas"
0801708,2022,Incendio,Reacondicionamiento del sistema incendio
0801708,2023,Albañileria / Pintura,"Reacondicionamiento para 7 aulas, Adicional por zocalos"
0801708,2023,Electricidad,Prov. Coloc nuevos teléfonos y nueva lín
0801708,2023,Gas,Adecuación según indicaciones de Metroga
0801764,2021,Carpinterías,Colocación de red antipalomas
0801764,2021,Gas,Cambio de campana cocina y adecuacion
0801764,2022,Carpinterías,"colocación de escalera en lateral patio, Colocación de pinches para palomas"
0801768,2021,Cubiertas / Impermeabilizaciones,Reparar filtraciones en techo
0801768,2021,Incendio,Cambio de central de alarma de incendio
0801768,2022,Cubiertas / Impermeabilizaciones,Rep filtración sobre muro de escalera
0801768,2022,Gas,Cambio de tramo de cañería embutida
0801768,2022,Sanitarias,Ejecución de red cloacal nueva del baño
0801776,2021,Calefaccion y Refrigeracion,Reparacion de Caldera y puesta en marcha
0801776,2021,Electricidad,"Colocacion llaver general Edenor, Fallas en iluminación de Emergencia"
0801776,2021,Gas,Reparación cocina y termotanque
0801776,2021,Incendio,reacondicionamiento de tablero para bomb
0801776,2021,Medios de elevación,Puesta en normativa ascensor
0801776,2021,Sanitarias,Construcción de pozo para desagüe
0801776,2022,Calefaccion y Refrigeracion,Cambio de quemador en caldera
0801780,2022,Gas,Cambio de 17 estufas
0801796,2021,Incendio,cambio de cetral de incendio
0801796,2021,Sanitarias,Cambio de termotanque laboratorio
0801796,2022,Carpinterías,Instalación de rejas y protecciones
0801796,2022,Electricidad,Istalación de tomas
0801808,2021,Albañileria / Pintura,"Reparar solado patio jardin, Reparación de guardaganados prim,jardin"
0801808,2021,Carpinterías,Reponer vidrios
0801808,2021,Gas,Readecuac. inst. gas cocina y S.Medidore
0801808,2023,Sanitarias,Reparación de la cámara cloacal
0801812,2021,Carpinterías,"Provision de jaula metalica/seguridad, Protección caja escalera y vacio PB"
0801812,2021,Electricidad,"Obra Civil Construccion Pilar Tarifa, Adicional alimentador pilar a tablero"
0801812,2021,Incendio,Proveer Extintores 5 Kg ABC
0801812,2022,Calefaccion y Refrigeracion,Instalacion segun normativa AA
0801812,2022,Electricidad,Instalación electrica en sala musica
0801816,2021,Albañileria / Pintura,"Acondicionar muro medianero-Sector Juego, Piso de goma para el patio de jardin"
0801816,2022,Albañileria / Pintura,Pintura de fachada
0801816,2022,Carpinterías,Colocación de reja para ventana
0801816,2023,Albañileria / Pintura,Reparación humedades en Placares y muros
0801828,2021,Albañileria / Pintura,Pulido y plastificado de piso madera
0801828,2021,Carpinterías,Colocar rejas en escalera
0801828,2022,Carpinterías,Rejas de exterior para casa ex casero
0801832,2021,Gas,Adecuacion instalacion de gas
0801836,2021,Albañileria / Pintura,Pintura en aulas y espacios comunes
0801836,2021,Calefaccion y Refrigeracion,Cambio de calderas elect.Prov e Instal.
0801836,2021,Electricidad,PROV Y COLOCACION DE LUCES DE EMERGENCIA
0801836,2021,Gas,Prov y coloc nueva cocina en Casa casera
0801836,2021,Otros Servicios,Prov y col bombas de achique
0801836,2022,Gas,Cambio de llaves de paso de estufas
0801836,2022,Incendio,Provision y colocacion de matafuegos
0801836,2022,Otros Servicios,Provision y Colocacion de Ventiladores
0801840,2021,Albañileria / Pintura,Cambio de escalones en escalera ppal.
0801840,2022,Otros Servicios,"Instalacion proyector y pantalla en SUM, Pintura de patio y pasillos"
0801840,2022,Sanitarias,Proveer y colocar pileta en aula PB
0801860,2021,Calefaccion y Refrigeracion,Instalación de 1 purificador
0801860,2021,Carpinterías,"Protección circulaciones balcones vacio, Protección cajas escaleras y otros"
0801860,2021,Incendio,Proveer Extintores 5 Kg ABC
0801860,2021,Medios de elevación,Puesta en normativa ascensor
0801860,2021,Sanitarias,provision y colocacion termotanque
0801860,2022,Albañileria / Pintura,"Adecuacion 5 aulas "" Secundarias Futuro"""
0801860,2022,Electricidad,Ejecución Instalacion Luz de Emergencia
0801860,2022,Incendio,Normalizacion Sistema contra Incendio
0801864,2021,Carpinterías,"instalar rejas en ventanas del 1er piso, Cambio de vidrios aberturas 1º piso"
0801864,2021,Incendio,cambio de cetral de incendio
0801864,2022,Albañileria / Pintura,Pintura patio y pasillo rampa exterior
0801864,2022,Calefaccion y Refrigeracion,Insatalación de equio A.A. secretaria
0801864,2022,Electricidad,Aulas del futuro
0801864,2022,Incendio,4 extintores ABC de 5 kg secretaria
0801864,2023,Electricidad,instalación de seguridad
0801996,2021,Calefaccion y Refrigeracion,Puesta a punto caldera
0801996,2021,Sanitarias,Cambio de 2 tanques cisternas
0801996,2022,Carpinterías,"Adecuacion gimnasio, Colocar toldos patios 1er piso, Colocar toldos patio PB"
0801996,2022,Cubiertas / Impermeabilizaciones,Reemplazo de chapas sinusoidales
0801996,2022,Electricidad,"Adecuacion electrica biblioteca, secreta"
0801996,2023,Albañileria / Pintura,Pintura rampa interna PB a 1°P
0802004,2022,Sanitarias,Reparación canaleta pluvial de lucarna
0802024,2021,Electricidad,"Instalación de luces de emergencia, Adecuacion espacio digital"
0802024,2021,Otros Servicios,ADECUACION PATIO DE JUEGOS
0802024,2022,Carpinterías,"Provision y colocacion Pantalla sobre li, provision y colocacion de red antipaloma, Prov. y colocacion de lona en perimetro"
0802024,2022,Electricidad,Adecuacion direccion jardin
0802036,2021,Calefaccion y Refrigeracion,Reparación en calefaccion y tablero
0802036,2021,Cubiertas / Impermeabilizaciones,cambio parcial de membrana
0802036,2022,Calefaccion y Refrigeracion,PROVEER CALEFACCIÓN A 2 AULAS
0802036,2022,Carpinterías,"Provision reja jardín y columnas gim, CAMBIO DE CERRADURAS ACCESO"
0802036,2022,Medios de elevación,Actualización control ascensor
0802036,2023,Electricidad,INSTALACION EN ESPACIOS SEGUROS
0802040,2021,Albañileria / Pintura,Pulido y plastificado piso sala jardin
0802040,2021,Carpinterías,Espejo de baño varones PB
0802040,2021,Saneamiento,Remoción de panal de abejas casa vecino
0802040,2022,Albañileria / Pintura,"Reparacion de revoques por filtracion, Reparación revoques pintura de paredes, Reparacion de revoques, pintura de frizo"
0802040,2022,Carpinterías,"Pulido de piso, pintura de paredes"
0802052,2021,Albañileria / Pintura,"Rep cielorraso y pintura-Aulas PA, Pintura de 2 aulas de jardin, Pintura paredes patio jardin"
0802052,2022,Albañileria / Pintura,Picar y rehacer revoques de 2 paredes
0802052,2022,Calefaccion y Refrigeracion,Provsion y colocacion equi. calefaccion
0802052,2022,Cubiertas / Impermeabilizaciones,Impermeabilizacion vivienda casero
0802052,2022,Sanitarias,Cambio de inodoro corto
0802052,2023,Albañileria / Pintura,Pintura de aula comedor
0802052,2023,Carpinterías,Reposicion de 17 persianas de fachas
0802056,2021,Otros Servicios,"Arenero, Piso antigolpe, pintura protecc"
0802056,2022,Carpinterías,Prolongacion rejas de proteccion.
0802068,2021,Electricidad,Colocacion de purificador
0802068,2021,Gas,"Cambio artefacto cocina, Cambio puerta de nicho de gas"
0802068,2022,Albañileria / Pintura,"Adecuacion de Comedor., Proyecto sala de Danza y Maestros."
0802068,2022,Cubiertas / Impermeabilizaciones,Impermeabilizacion cubierta sala Danza
0802068,2022,Electricidad,Adecuacion tablero electrico principal.
0802068,2023,Albañileria / Pintura,"Pintura Patio exterior., Pintura Comedor, Caja de escaleras SUM, Pintura Pasillo primer piso"
0802204,2022,Electricidad,Colocación de luces de emergencia
0802204,2022,Incendio,Acondicionar la IFCI
0802204,2022,Medios de elevación,Reeparación de ascensor
0802228,2021,Electricidad,Colocación de luces de emergencia
0802228,2021,Sanitarias,Cambio tanque cisterna patio
0802228,2023,Albañileria / Pintura,REACONDICIONAMIENTO AULA
0802228,2023,Sanitarias,Adecuacción baño de inicial y cambiador
0802248,2022,Albañileria / Pintura,AULAS SECUNDARIAS DEL FUTURO
0802248,2023,Electricidad,Instalacion para Espacios Seguros
0802348,2021,Calefaccion y Refrigeracion,Recambio de caloventiladores.
0802348,2022,Calefaccion y Refrigeracion,Plataforma para caloventiladores
0802348,2022,Incendio,"Reposición de faltantes IFCI, Prov. Coloc. de extintores, Reposición de faltantes IFCI"
0802348,2023,Calefaccion y Refrigeracion,Caloventiladores e-2
0802348,2023,Electricidad,Protocolo espacios seguros
0802364,2023,Albañileria / Pintura,"Trabajos de pintura y circulaciones, Pintura de sectores varios"
0802368,2021,Gas,Reparaciones en instalacion de gas
0802368,2022,Albañileria / Pintura,Reparación de revoques y pintura aulas
0802368,2022,Electricidad,Instalación de purificadores
0802368,2022,Incendio,Colocación de 2  matafuegos
0802388,2021,Carpinterías,Provisión rejas de seguridad-Ventanas
0802388,2022,Electricidad,Colocación de luces de emergencia
0802392,2021,Calefaccion y Refrigeracion,Colocación de purificadores
0802392,2021,Carpinterías,Prov y colocación de puertas de reja
0802392,2021,Cubiertas / Impermeabilizaciones,IMPERMEABILIZACIÓN DE AZOTEA
0802392,2022,Albañileria / Pintura,Retiro de tabique en informática y lab
0802392,2023,Albañileria / Pintura,Pintura en espacios comunes interiores
0802396,2022,Albañileria / Pintura,PINTURA FRISO EN FACHADA
0802396,2023,Gas,REEMPLAZO CINCO ESTUFAS
0802412,2021,Carpinterías,Prov. Coloc.mosquitero ventana cocina
0802412,2022,Electricidad,Insonorización extracción cocina
0802412,2022,Incendio,Provisión 2 Matafuegos no prov x Obra
0802412,2023,Electricidad,"Insonorización extracción cocina, Reparar Sist.Alarmas s/informe ASBA"
0802484,2021,Electricidad,"Colocar 2 ventiladores sala computacion, Colocar timbre casa de casera, Colocar art electrico salida comedor, colocar artefacto electrico en escalera"
0802488,2022,Calefaccion y Refrigeracion,Instalación para A°A°
0802492,2021,Albañileria / Pintura,Reparación de revoque en áreas de sala
0802500,2022,Incendio,Colocacion de matafuegos
0802500,2023,Albañileria / Pintura,"Reparación y pintura de patios, Pintura del patio, etapa 2"
0802504,2021,Albañileria / Pintura,"Rep pared irregular aulas,pase cañeria"
0802504,2021,Carpinterías,"reparar 10 puertas de madera rotas, Colocar placares en aulas"
0802504,2022,Carpinterías,Cambio puerta doble de acceso
0802504,2022,Electricidad,Reemplazar ventiladores faltante o rotos
0802504,2022,Medios de elevación,Reparar ascensor
0802504,2022,Sanitarias,Reponer inodoro roto
0802504,2023,Carpinterías,Reponer cerraduras rotas
0802504,2023,Sanitarias,Reemplazo de griferias en baños
0802532,2021,Calefaccion y Refrigeracion,Colocar purificador de aire
0802532,2021,Carpinterías,"Cambiar cerraduras aulas 1 y 2 x vandali, Coloc 2 pasadores-Cuarto bombas"
0802532,2021,Electricidad,"Coloc 10 tomas dobles-Direc,secretaria, Coloc. secamanos electrico"
0802532,2021,Incendio,"Coloc extintor A informat,BC laboratorio, Colocacion de hidrantes x vandalismo."
0802532,2021,Otros Servicios,nivelar superficie verde en patio jardin
0802532,2021,Sanitarias,"Coloc canilla entre bebederos-Entrada, Colocar inodoro Bº V"
0802532,2022,Albañileria / Pintura,"Coloc alambre de púa-Pintar carpinterías, Ejecución de contrapiso y carpeta"
0802532,2022,Electricidad,"Reemplazar 7 ventilaores, Reemplazo de 18 luces de emergencia,"
0802532,2022,Gas,Adecuación instalación de gas
0802532,2022,Incendio,Reponer dos lanzas de bronce
0802532,2022,Otros Servicios,retiro de dos juegos
0802532,2022,Sanitarias,"Prov y coloc.  inodoro en baño por vanda, Prov y coloc.  inodoro en baño"
0802532,2023,Electricidad,Remplazo de ventiladores.
0802576,2022,Incendio,IFCI Apto para su uso
0802576,2022,Medios de elevación,"Reparación ascensor edificio trasero, Reparación ascensor patio"
0802576,2023,Albañileria / Pintura,Desmontaje cielorraso sector administrac
0802576,2023,Electricidad,"Adecuación de 5 aulas Sec. Futuro, INSTALACION EN ESPACIOS SEGUROS"
0802588,2021,Gas,Readecuacion instalacion completa de gas
0802588,2021,Incendio,Reponer hidrante por vandalismo
0802588,2022,Calefaccion y Refrigeracion,Prov. coloc. 11 placas Eco sol 900watt
0802588,2022,Carpinterías,Remplazo de 4 puertas y arreglo de las d
0802588,2022,Cubiertas / Impermeabilizaciones,"IMPERMEABILIZACION DE AZOTEA, Remplazo de chapas en hall de entrada"
0802588,2022,Gas,Reemplazo del tanque de expansión
0802588,2022,Medios de elevación,Adecuacion de ascensor
0802588,2022,Sanitarias,"Puesta en marcha de 2 baños PB y 2 en PA, Remplazar inodoro corto capea por vandal"
0802588,2023,Electricidad,Prov.Coloc. luces de emergencia
0802644,2021,Electricidad,Instalacion de 7 purificadores de aire
0802644,2022,Sanitarias,Cambio 2 tanques de agua
0802652,2021,Albañileria / Pintura,"Cambio solado por del patio Jardín, Filtraciones y pintura"
0802652,2022,Albañileria / Pintura,"Pintura de un aula pasillo y persianas S, Pintura hall acceso, Pintar el pasillo de PB, Pintar aulas de PB"
0802652,2022,Electricidad,Instalacion de 7 purificadores
0802672,2021,Albañileria / Pintura,Arreglo filtración baño del casero
0802672,2021,Cubiertas / Impermeabilizaciones,Reparacion techo plastica y musica
0802672,2022,Albañileria / Pintura,"Arreglo patio casero, piso y cielorrasos"
0802672,2022,Electricidad,Instalacion de 8 purificadores
0802704,2021,Carpinterías,"Rejas para Biblioteca, Pluviales Fachada"
0802704,2022,Gas,Termotanque 80lt Viv. casera
0802704,2023,Calefaccion y Refrigeracion,Coloc.6 Split provistos por Cooperadora
0802704,2023,Gas,Estufa tb 3500cal por fin vida útil
0802712,2021,Gas,Tareas solic x Metrogas p Levant corte
0802712,2022,Gas,Reemplazo Calefon 14lts fin vida util
0802712,2023,Gas,Solenoide horno por falta de vástago
0802720,2021,Gas,Reacondicionamiento Gas
0802812,2021,Albañileria / Pintura,Demolición de solado en patio
0802816,2021,Calefaccion y Refrigeracion,Adecuación de sistema de calefaccíon
0802816,2021,Electricidad,Inst portero eléct c/telefono-Jardin
0802816,2021,Gas,Reemplazo de reguladores en gabinete
0802820,2021,Gas,Colocación protección estufas TB
0802820,2022,Carpinterías,Cambiar cortinas de enrollar biblioteca
0802844,2021,Incendio,instalación contra incendio
0802844,2022,Albañileria / Pintura,"Albañilería. patio de juegos JIN C, Povisión piso antigolpe  s/indicaciones"
0802844,2022,Sanitarias,Cambio de camara desengrasadora
0802872,2021,Albañileria / Pintura,"Reparación de timpano, Cambio de solado vicedirección,secretar, Construcción de contrapiso"
0802872,2021,Calefaccion y Refrigeracion,Adecuación de sistema de calefaccíon
0802872,2021,Carpinterías,"Coloc red protección 3 aberturas, Colocacion de Pizarrones"
0802872,2021,Cubiertas / Impermeabilizaciones,Reposición de tejas coloniales en cubie
0802872,2021,Electricidad,"Prov, coloc portero electrico jardin"
0802872,2022,Albañileria / Pintura,"Reemplazo de solado en aula PB, Recambio de solados biblioteca"
0802872,2022,Carpinterías,Remplazo de red de proteccion en patio
0802872,2023,Electricidad,Instalación en espacios seguros
0802888,2021,Carpinterías,Proteccion estufas y ventanas aulas 1° p
0802888,2022,Albañileria / Pintura,"Puesta en valor casa casero, laboratorio"
0802904,2021,Albañileria / Pintura,Aulas del futuro PB y PA
0802904,2021,Gas,Cambio de picos de gas en laboratorios
0802904,2021,Medios de elevación,Reparar ascensor
0802904,2022,Albañileria / Pintura,Adecuación de tres aulas PA- SDF
0802904,2023,Albañileria / Pintura,Puesta en valor de aulas SDF
0802904,2023,Electricidad,Instalación en espacios seguros
0802964,2021,Albañileria / Pintura,Revoques y pintura de patio exterior
0802964,2022,Electricidad,Colocación luces emergencia
0802968,2021,Carpinterías,Cambio de persianas
0802968,2021,Cubiertas / Impermeabilizaciones,IMPERMEABILIZACION CUBIERTA
0802968,2022,Carpinterías,Cambiar persianas en el establecimiento
0802968,2023,Carpinterías,Desratizacion y cambio de persianas
0802972,2021,Calefaccion y Refrigeracion,Reparacion bombas caldera
0802972,2021,Carpinterías,"Colocacion de vidrios, Cambio de persianas"
0802972,2021,Cubiertas / Impermeabilizaciones,Arreglo filtraciones sala calderas
0802972,2021,Incendio,Adecuación IFCI Falta adjuntar presupues
0802972,2021,Medios de elevación,"Arreglo Ascensor, Arreglo ascensor por sobrecarga, balanza"
0802972,2021,Saneamiento,Cambiar los tanques de reserva
0802972,2022,Carpinterías,Desratizacion y persianas
0802972,2022,Electricidad,"Luces de emergencia natatorio, Arreglo ascensor por ingreso de agua Se, Colocacion tomacorrientes en aulas"
0802972,2023,Albañileria / Pintura,Reacondicionando los baños
0802972,2023,Calefaccion y Refrigeracion,"RETRO, PROV Y COLOCACION DE PERSIANAS"
0802972,2023,Electricidad,Espacio de seguridad
0803016,2021,Carpinterías,Ventanas con mosquiteros y rejas
0803016,2022,Carpinterías,Protecciones de escalera y rampa
0803016,2022,Cubiertas / Impermeabilizaciones,Cambiar chapas en cubierta del patio
0803020,2021,Albañileria / Pintura,Piso cerámico en sala de dirección
0803020,2021,Saneamiento,Proveer y colocar 7 purificadores
0803020,2022,Carpinterías,Proveer y colocar reja-Dirección
0803024,2021,Gas,Provisión: rejas de protección y cocina
0803024,2022,Albañileria / Pintura,Apertura de vano-Sala Maestros
0803056,2021,Electricidad,Cambio de central telefónica
0803056,2022,Carpinterías,Reja y malla de proteccion para patio
0803056,2022,Electricidad,"Ejecucion de instalacion para AA en S.S., Solicitud de c y p IE y tomacorrientes"
0803084,2021,Albañileria / Pintura,Refaccion casa casero
0803084,2022,Carpinterías,Cambio de 3 ventanas en JIN
0803084,2022,Gas,Inst de gas v. solenoide y extractor
0803084,2022,Sanitarias,Cambio de tanques cisternas
0803084,2023,Albañileria / Pintura,"Pintura en cielorraso, pared"
0803096,2021,Calefaccion y Refrigeracion,Reparación de caldera
0803096,2021,Carpinterías,Redes y pintura en gimnasio
0803096,2021,Gas,Adecuación de instalaciónes de gas
0803096,2021,Incendio,Recambio de matafuegos
0803096,2022,Incendio,Puesta en valor de IFCI
0803108,2021,Calefaccion y Refrigeracion,Instalación de 5 purificadores
0803108,2021,Sanitarias,Adecuaciones sanitarias y eléctricas
0803108,2022,Cubiertas / Impermeabilizaciones,Impermeabilización de muro Nivel Inicial
0803116,2021,Carpinterías,Cambio policarbonatos en acceso ppal
0803116,2021,Gas,"Ducto de ventilacion en sala de calderas, Adecuación de tren de válvulas, Ventilación en sala de maquinas"
0803116,2021,Sanitarias,Cambio bachas de hormigon salas y patio
0803116,2022,Albañileria / Pintura,"Reparación de guardaganados, Protecciones para barandas"
0803116,2022,Electricidad,"Colocación de luces en rampa, Reemplazo de 6 ventiladores"
0803116,2023,Carpinterías,Protecciones para barandas
0803120,2021,Saneamiento,retiro de panal de abejas en patio
0803120,2022,Electricidad,Instalación del Pilar
0803120,2022,Sanitarias,Reemplazo de bombas pluviales.
0803124,2022,Electricidad,Colocación luces emergencia
0803124,2022,Gas,Sistema de extracción de 2 anafes
0803136,2021,Electricidad,Instalación 9 equipos purificadores de a
0803136,2022,Albañileria / Pintura,Solicitud de c y p desmonte tabique
0803136,2022,Gas,Refaccion aula 4to grado
0803136,2023,Albañileria / Pintura,Pintura en salas y hall de entrada JIN
0803224,2021,Albañileria / Pintura,Piso de Goma Patio de Juegos Inicial
0803224,2021,Calefaccion y Refrigeracion,"Conducto Reglamentario Sala Caldera, Conducto Ventilación SUM, Aire Acondicionado F/C  7mo grado PA"
0803224,2022,Albañileria / Pintura,Reparacion y Pintura Fachada
0803224,2022,Calefaccion y Refrigeracion,Aire Acondicionado Direccion Inicial
0803224,2022,Electricidad,Timbre portero Sala Cooperadora
0803224,2023,Sanitarias,Cambiador en Sala de 2 años Inicial
0803228,2021,Calefaccion y Refrigeracion,"Placas refractarias para horno ceramico, Colocación de purificadores"
0803228,2021,Sanitarias,6 bajadas pluviales
0803228,2022,Albañileria / Pintura,Adecuación de escalera en sala de música
0803228,2022,Carpinterías,Cambiador para bebes
0803228,2022,Electricidad,"Adecuar instalacion electrica, Tendido electrico carros de computacion, Reemplazo de ventiladores en aulas de ni, Portero eléctrico con visor"
0803228,2022,Otros Servicios,Colocación  de un matafuegos faltante
0803228,2023,Electricidad,provision de 2 ventiladores para direcci
0803236,2021,Albañileria / Pintura,reparar cielorraso de alero patio Plazo
0803236,2021,Calefaccion y Refrigeracion,Reponer termostato vandalizado
0803236,2021,Carpinterías,reponer dispositivo de techo corredizo
0803236,2021,Electricidad,instalar 2 equipos purificadores en aula
0803236,2021,Gas,Poner en norma instalacion de gas renglo
0803236,2022,Sanitarias,reponer inodoro roto baño de varones
0803244,2021,Albañileria / Pintura,"Trabajos albañileria-Coloc cocina. Se so, Reparar pared divisoria S.Inform y aula."
0803244,2021,Carpinterías,Cubierta-Carpinterias-Portero electrico.
0803244,2021,Electricidad,provision y colocación de 5 ventiladore
0803244,2021,Gas,Puesta a norma instalacion de gas. Cual
0803244,2022,Electricidad,Colocar 3 ventiladores y tomas
0803244,2022,Sanitarias,Receptáculo de B° Casera y cocina
0803244,2023,Albañileria / Pintura,Reparacion  revoques y pintura de friso
0803244,2023,Electricidad,Proveer ventiladores-Modif inst S Video
0803252,2021,Albañileria / Pintura,"Reparación en caja de escalera, Ejecución de cielorraso e iluminación"
0803252,2021,Incendio,Reemplazo de Central IFCI
0803252,2023,Albañileria / Pintura,Pintura en cielorrasos y cubierta
0803256,2021,Electricidad,"provision y colocación de 5 ventiladores, Instalación de purificadores.Las horas d"
0803256,2022,Albañileria / Pintura,Pintura de patio incluye puertas y revoq
0803256,2022,Electricidad,"Cambio de ventilador en 4A, Reforzar inst eléctrica de S Comp"
0803256,2022,Gas,puesta en norma de instalación de gas
0803256,2022,Sanitarias,Cambio de inodoro de baño nenas
0803256,2023,Electricidad,Prov.Coloc seis ventiladores de pared
0803264,2021,Albañileria / Pintura,"Reparar y pintar sector patio exterior, Pintura Friso Escalera Supervision"
0803264,2021,Sanitarias,Instalacion provisiones de agua
0803264,2022,Calefaccion y Refrigeracion,Aire Acond Supervision Escolar
0803264,2022,Gas,Colocar protecciones de estufas TB
